urlOfProject,nameOfProject,descriptionOfProject,problemSolved,challengesFaced,technologiesUsed
https://devfolio.co/projects/decentralised-cab-booking-system-777e,Decentralised CAB BOOKING SYSTEM,Our project is a decentralized and secure cab booking system wh provides ride booking services using blockchain technology without any third party.,,,"Solidity, Metabase, MongoDB, Ganache, Nodejs, React js"
https://devfolio.co/projects/lummy-9a9c,Lummy,Decentralized Ticketing Platform,,,"Solidity, React, OpenZeppelin, TypeScript, ERC-721, Vite, Chakra UI, foundry, Lisk, Xellar Kit"
https://devfolio.co/projects/spoton-8446,spotOn,"a website which can help in geting stuff on rent with quick nearby acess.
this website can be very functional in college.",,,"Django, JavaScript, CSS3​, HTML5​, Bootstrap​"
https://devfolio.co/projects/smart-water-grid,Smart Water Grid,This project demonstrates a decentralised smart water grid which is implementex using IoT and Blockchain. All the users can purchase and sell pure water on grid in exchange of tokens.,,,"Firebase, NodeMCU, Arduino"
https://devfolio.co/projects/metaborrow-a25e,MetaBorrow,MONETIZE YOUR GAMING ASSETS,,,"Solidity, JavaScript, Polygon, Push Protocol, REvise"
https://devfolio.co/projects/emergency-ring,Emergency Ring,The Key to Safety is in your Hands!!,,,"HTML, CSS, Arduino Uno, Arduino IDE, Python, C\C++, Twilio Rest API, Ishita

Goyal"
https://devfolio.co/projects/weavechat-b878,WeaveChat,"Decentralised, Fast and AI Powered Chatrooms on AO hyper parallel computer",,,"Express.js, next, aos, Arweave, gemini, AO, AOConnect, 0rbit, Liteseed"
https://devfolio.co/projects/brainstormy-7445,Brainstormy,Dive deeper into whole new world of unconventional learning and fun through educational games!,,,"Node.js, TensorFlow, p5.js, Express.js, Vanilla JS, HTML/CSS"
https://devfolio.co/projects/techcollab-9df4,techcollab,"The All-in-One Platform for Freelancers, Events, and Communities",,,"Socket.IO, Cloudinary, TypeScript, MongoDB Atlas, Vercel, React js, Render, Google Auth"
https://devfolio.co/projects/emotion-classifier-5227,Emotion Classifier,Your Emotions are being Monitored !!,,,"Machine Learning, Artificial Intelligence, Support Vector Machine (SVM), Webapp, Backend, Audio Data, Feature Engineering"
https://devfolio.co/projects/buho,Buho,Efficiency redefined,,,"Firebase, Dart, Flutter, Adobe XD"
https://devfolio.co/projects/galleria-ad7d,Galleria,We provide a personalized experience through Augmented Reality which eases your task of finding the perfect furniture/Decor for your homes,,,"React, Firebase, ARKit, Firestore, echoAR, AR Core"
https://devfolio.co/projects/code-labs-999c,Code Labs,"The main goal of the project is to create advancement in E-Learning.
The main problem that the educational system is facing, is how to provide practical knowledge through E-learning.",,,"Node.js, Socket.IO, Express.js, MongoDB"
https://devfolio.co/projects/dygnify-9b1e,Dygnify,"World’s first on+off chain smb credit reputation scoring system, which can democratise access to credit for small businesses. This is built on top of our existing Defi protocol Dygnify for SME credit",,,"IPFS, Biconomy, Gnosis Chain, Covalent, Polygon, ENS, Safe, Push Protocol, Ether spot"
https://devfolio.co/projects/hyperland-da6b,Hyperland,A 3D Sanbox Game built on top of SUI utilizing it's fluid object based contract apporach.,,,"Three.JS, Tailwind CSS, React.js, Zustand, Dapp-SDK, Sui-Cli, Sui-Wallet"
https://devfolio.co/projects/sessions-b9ef,Sessions,"Sessions allow you to save chrome tabs as workspaces so that you can declutter your chrome, restore your tabs at any time and save valuable memory in just 2 clicks",,,"JS, Git, GitHub, CSS3, Moment.js, Chrome Extension, HTML5​, Local Storage, Manifest 3.0"
https://devfolio.co/projects/michi-protocol-afb6,Michi Protocol,"Michi is a trustless marketplace for points. We use ERC-6551 to create NFT-linked wallets that earn points on any existing protocol. By selling the NFT, any points accrued in the wallet are also sold.",,,"Solidity, React, Node.js, TypeScript, foundry, Wagmi, Viem, ERC-6551 (Tokenbound Accounts)"
https://devfolio.co/projects/lets-deliver-it-8eed,lets deliver it,Earn,,,"Node.js, Express.js, MongoDB, Material-UI, React.js, Sawo API"
https://devfolio.co/projects/flows-got-talent-1883,Flow's Got Talent,"Gamifying the Flow NFT ecosystem:  Use any Flow PFP NFT as in-game characters.
Compete against other players in epic minigames.",,,"Firebase, JavaScript, Three.JS, VueJS, Midjourney, chatgpt, Flow Client Library (FCL)"
https://devfolio.co/projects/blood-bank-management-system-6a7f,Blood Bank Management System,Spare only 15 minutes and save one life,,,"PHP, HTML, CSS, JavaScript, MySQL, phpMyAdmin, Bootstrap​"
https://devfolio.co/projects/razorpay-zapier,Razorpay @Zapier,Now connect 2000+ Apps at your fingertips with Razorpay Integration,,,"JavaScript, Razorpay, zapier"
https://devfolio.co/projects/speech-recognition-mysql-database-management-7374,Speech Recognition MySQL Database Management,"We have developed a python library called MySQLvoice which will not require any coding for maintaining databases of MySQl, What it needs is just your simple regional language as voice input.",,,"MySQL, Artificial Intelligence, Python, Natural language processing (NLP), Speech Recognition, MySQL Server"
https://devfolio.co/projects/saarthi-for-those-in-need,"Saarthi ?, A support system for those in need.","Saarthi takes a multi-dimentional approach towards helping those in need of Financial, Medical or Computational Resources, available across 12 Indian regional languages.",,,"Solidity, Node.js, TensorFlow, Python, Matic, Web3, Microsoft Azure"
https://devfolio.co/projects/ai-gym-training-and-tracking-0ddf,AI Gym Training and Tracking,The issue that ML-powered gym workout tracking and training addresses,,,"NumPy, OpenCV, Python, Jupyter Notebook, Mediapipe, Streamlit"
https://devfolio.co/projects/sidebets-18c2,Sidebets,Social prediction markets for onchain communities,,,"Node.js, PostgreSQL, web3.js, Telegram bot API, Prisma"
https://devfolio.co/projects/bachao,Bachao,"A safety app that goes the extra mile to help you, where even networks fail.",,,"Java, Dart, Flutter"
https://devfolio.co/projects/vaxiqueue-b994,VaxiQueue,Vaxiqueue is an algorithm based vaccine queue information app which calculates a persons approximate position in the queue of people waiting for the vaccination program .,,,"AdobeXD, Android Studio IDE"
https://devfolio.co/projects/turbine-0468,Turbine,Elevate your programming experience,,,"Nodejs, React.js, Electron JS"
https://devfolio.co/projects/medishare-7bba,Medi-Share,Caring by SHaring,,,"Node.js, Firebase, Flutter, MongoDB, ML Classifier, Tesseract OCR, mongoose, Jitsi, React.js, ChartJs"
https://devfolio.co/projects/behave-e63c,Behave,Bridging the gap between students and teachers,,,"TensorFlow, OpenCV, Machine Learning, Nodejs"
https://devfolio.co/projects/pokatika-6406,POKATIKA,POKATIKA is a mobile application that enhances the post-event experience with unique NFT photo cards. Our goal is to provide an exclusive experience to users with zero-barrier onboarding to web3.0.,,,"IPFS, React, JavaScript, Java, REST API, AWS Lambda, Spring, AWS EC2, keypom, near-sdk-js"
https://devfolio.co/projects/new-generation-elearning-9d21,Transparent Open Collaborative E-Learning Platform,We are building an e-learning platform that uses smart contracts to solve the problems I mentioned. This will make the process more transparent and fair for both students and teachers.,,,"Node.js, Next.js, Express.js, Rust, React.js, NEAR Protocol, BOS"
https://devfolio.co/projects/krishi-brahmand-9618,Krishi Brahmand,Fresh from Farm to Plate.,,,
https://devfolio.co/projects/panda-wallet-698f,Panda Wallet,Where Web3 meets the Lazy!,,,"React, Hardhat, chakraui, ether.js, EF: Account Abstraction, EIP 4337"
https://devfolio.co/projects/the-kings-grammar-by-sanjay-kumar-sinha-pdf-8430,The kings grammar by sanjay kumar sinha pdf,The kings grammar by sanjay kumar sinha pdf,,,Python
https://devfolio.co/projects/cyster-caring-for-her-5b1d,CYSTER- caring for her,"Solving big problems , by taking care of you daily. Cyster helps you be more self-aware, and we stay together on your journey through PCOS.",,,"React, JavaScript, Postman, JWT, MongoDB, HTML/CSS, Nodejs, Express"
https://devfolio.co/projects/smartmeds-769e,SmartMeds,"SmartMeds is a blockchain-based hospital management system that ensures a secure platform for managing patient records, prescriptions, medication adherence and appointment scheduling.",,,"Solidity, Node.js, Visual Studio Code, MetaMask, Infura, Figma, GitHub, Ethereum, web3.js, React.js"
https://devfolio.co/projects/bmi-buddy-bff5,BMI Buddy,Fit body BMI Coach,,,"Java, XML, Kotlin"
https://devfolio.co/projects/lendchips-f666,LendChips,"Unlocking NFT Potential Across All Chains: Your Journey, Your Way
(Cross chain Lending and Borrowing for NFT's)",,,"Solidity, React"
https://devfolio.co/projects/zksafe-173a,zkSafe,zkSafe enables to use your Safe with your web2 accounts thanks to Sismo zkConnect. You don't need anymore your private keys and you can also setup a social recovery with your friends and family.,,,"Safe, Sismo, zkConnect"
https://devfolio.co/projects/salary-dapp-6b71,Salary Dapp,This is a Salary Management Dapp that lets an organization's admin add employees and send them payments in Ethereum.,,,"Solidity, MetaMask, JavaScript, Next.js, ethers.js, Matic, Ethereum, Blockchain, Tailwind CSS"
https://devfolio.co/projects/certificate-generator-3f02,Certificate Generator,"1.  Issue Certificate (organizers)
2. Send Certificate (from organizers to users)
3. Verify Certificate (users)",,,"jQuery, JavaScript, Remix IDE, SCSS, Ethereum, CSS3​, HTML5​, Bootstrap​"
https://devfolio.co/projects/certichain-certification-on-ethereum-blockchain,CertiChain: Certification on Ethereum Blockchain,"Blockchain based Certificate Authentication Application
A blockchain application to verify the essential documents of an the applicant during the hiring process.",,,"Smart Contract, Natural language processing (NLP)"
https://devfolio.co/projects/virtual-tryon-1c99,Virtual TRY-ON,TRY BEFORE YOU GET IT !,,,"TensorFlow, Python, Unity 3D, Lens Protocol, Augumented Reality, Snap AR, Snapchat SDK"
https://devfolio.co/projects/gravitrax-bauanleitung-mit-allen-erweiterungen-pdf-f712,Gravitrax bauanleitung mit allen erweiterungen pdf,Gravitrax bauanleitung mit allen erweiterungen pdf,,,Python
https://devfolio.co/projects/nifty-bridge-3d4c,NIFTY BRIDGE🌉,Cross Chain NFT Bridge For Ethereum <-> Polygon <->BSC <-> Other EVM Compatible Chains😲.,,,"Solidity, Ant Design, Docker, Golang, React.js, Covalent, Polygon, StackOS"
https://devfolio.co/projects/eyecancode-8037,EyeCanCode,From voice to vision,,,"React, Node.js, Tailwind CSS, Alan-AI"
https://devfolio.co/projects/guerilla-lock-security,Guerilla Lock Security,Hidden security system with Break-in detection and remote keyless entry that can be installed over existing locks.,,,"Android, Android Studio, NodeMCU, Cloud computing, Arduino, Iot"
https://devfolio.co/projects/equiid-66ab,EquiID,"Equal Opportunities, Equal Pay: Get Paid for Your Talent, Regardless of Gender or Nationality or any other factor!",,,"Solidity, React, Multer, Tesseract OCR, Tailwind CSS, DigitalOcean, Nodejs, Polygon, IPFS / Filecoin, Lighthouse"
https://devfolio.co/projects/ipfs-dropbox-and-filehash-generator-ff72,IPFS DROPBOX AND FILE-HASH GENERATOR.,"It allows you to submit files from your computer and generates a hash for it.
It also returns the filename and description you added so as to access the file later even if the file is deleted.",,,"JavaScript, Infura, HTML/CSS, React.js"
https://devfolio.co/projects/janus-ad08,Janus,Janus is an Oracle Solution that enables Tokenization of Reputation by aggregating multiple sources of reputation into a single graph and gives an overall TrustScore for the Identity.,,,"Matic, Chainlink, The Graph, Portis, Filecoin, Unmarshal, Uniswap Sybil, Consensys"
https://devfolio.co/projects/healthcareai-1d1c,HEALTHCARE.AI,AI-Powered Diagnostic System,,,"HTML, CSS, JavaScript, Flask, Machine Learning, Deep Learning, Git, Python, React.js, Streamlit"
https://devfolio.co/projects/edusmart-d485,EduSmart,Let's Make It Real.,,,"echoAR, Node js, React js, Express js, Socket IO, SAWO Labs, React-three-fiber, Three JS"
https://devfolio.co/projects/bugbase-an-indian-bug-bounty-platform-6a1e,BugBase - An Indian Bug Bounty Platform,"Cybersecurity is the need of the hour. Vulnerabilities are everywhere, discovering bugs in highly used websites is daily news at this point. We present a solution-BugBase an Indian Bug Bounty platform",,,"We are faced with the challenge of making a large-scale web application in a 2 day time period which goes with an API in the backend. We decided to go with an approach that allows creating a single page application (SPA) which are known to be much faster than applications which serve the entire page e.g. Using res.render in NodeJS. This also allowed us to build the frontend and backend completely separately making the development of the product during the hackathon much faster as we assigned two members to each.
We decided to use NodeJS along with MongoDB as the building blocks for the backend API. We also used AWS S3 buckets to store the user profile pictures and any other large data that is generated including PDFs. We purchased the domain bugbase.in from GoDaddy and set up an email admin@bugbase.in with Zoho Mail. For the frontend, we chose to go with the frontend framework VueJS to manage all our routing and making API calls. The API is hosted on http://api.bugbase.in which has two routes /api/auth and /api, /api/auth is where the user gets authenticated and a JWT gets generated which can be used to access the /api route in the API. The frontend fetches the data using Axios and displays the data on the users end i.e. On http://bugbase.in. All have SSL certificates as they have been proxied through Cloudflare."
https://devfolio.co/projects/devnft-210b,DevNFT,Recognition to great Repos,,,"Solidity, IPFS, OpenZeppelin, Next.js, Mocha, Tailwind CSS, Hardhat, NextAuth.js, GitHubAuth, GithubApi"
https://devfolio.co/projects/sloe-supervised-learning-in-online-education-05e4,SLOE: Supervised Learning in Online Education,"SLOE is an add-on service to the online educational platform, which can identify a child's behavioral changes such as depression, confusion or unattentiveness and inform the parents about the same.",,,"Firebase, Figma, android-studio, Streamlit, TensorFlow-Lite, deep-learning"
https://devfolio.co/projects/cleancam-a709,CleanCam,"""Swachha sahar, sabaiko rahar"" is the slogan of our project. Our project ""CleanCam"" focuses on finding the guilty of littering in the urban places of Nepal.",,,"React, Flask, OpenCV, Google Colab, PostgreSQL, Tailwind CSS, YOLOv8"
https://devfolio.co/projects/simcomm-8d6f,SimComm,"Empowering Sellers, Unleashing Success",,,"PHP, JavaScript, WordPress, HTML/CSS"
https://devfolio.co/projects/bet-on-balls-20f4,Bet On Balls,Where Every Spin is a Win!,,,"MetaMask, Chainlink, Arbitrum Rollup, Celo, Polygon, Filecoin, Safe, Mantle, Scroll, BASE"
https://devfolio.co/projects/walletmetrics-google-analytics-for-dapps-7987,WalletMetrics : Google Analytics for DApps,"Code-free user analytics for DApps: Simplify on-chain analysis, track behavior, optimize projects, make informed decisions. Uncover trends, seize opportunities, maximize Web3 returns effortlessly.",,,"React, JavaScript, Docker, ethers.js, PostgreSQL, TypeScript, Ethereum, nest.js, Gnosis Chain"
https://devfolio.co/projects/savifi,SaviFi,"At SaviFi we offer a ""One Stop Smart Savings Account"" Defi platform that automatically transfers users' funds to the highest savings return Defi platform.",,,"jQuery, Bootstrap, JavaScript, HTML5, SQLite, Web3, DSA SDK, Biconomy SDK, Gnosis Chain, web3.js, InstaDapp"
https://devfolio.co/projects/binod-world-order-ef6a,..,..,,,"React, JavaScript, Rust, Nodejs, nextjs, SolanaSDK"
https://devfolio.co/projects/redtweet-c428,redTweet,classifying hate against humanity,,,"HTML, Django, scikit-learn, Machine Learning, Python, Tailwind CSS"
https://devfolio.co/projects/ghar-on-chain-a6ce,Ghar On Chain,"Easy Buy, Easy Sell",,,"React, React-Bootstrap, NFTPort, Cartesi, Push"
https://devfolio.co/projects/medfunds-5d95,MedFunds,Raise a Reliable helping hand,,,"Solidity, React, JavaScript, Kotlin, Matic, Blockchain, Tailwind CSS, HTML/CSS, Polygon Blockchain, web 3.0"
https://devfolio.co/projects/exosuit-e71f,Exo-Suit,Disappearing the Disability,,,Fusion360
https://devfolio.co/projects/library-management-system-b648,Library Management System,Making library mangement more easier and effective,,,"PHP, HTML, CSS, JavaScript, MySQL Server"
https://devfolio.co/projects/guideye-477b,GuidEye,"A python software that can help blind people find things like laptops, phones, etc the same way a guide dog guides a blind person in finding his way.",,,"TensorFlow, OpenCV, Python, Speech Recognition, Text-to-Speech"
https://devfolio.co/projects/ezmed-cb1e,EZMED,Medical consultation in Kolkata made easy with AI magic.,,,"CSS3​, HTML5​, Fastn, Chatbase"
https://devfolio.co/projects/shl-coding-questions-and-answers-pdf-123c,Shl coding questions and answers pdf,Shl coding questions and answers pdf,,,Python
https://devfolio.co/projects/green-choice-6eb6,Green Choice,"Green Choice empowers users to make eco-friendly choices
effortlessly, using advanced machine learning algorithms that
analyze their shopping habits and preferences",,,"React, Machine Learning, Redux, Express.js, MongoDB, mongoose, Nodejs"
https://devfolio.co/projects/codie-your-interviewprep-buddy-c224,Codie - your Interview-prep buddy,Codie is an AI powered chatbot that is intended to help you with your Software Interview Preparation and doubts related to coding problems.,,,"React, JavaScript, gpt-3, CSS3​, API"
https://devfolio.co/projects/medhub-4,MedHub_360,"MAKING HEALTH CARE EASY AND
ACCESSIBLE FROM ANYWHERE",,,"Node.js, JavaScript, Flask, Machine Learning, Deep Learning, Heroku, Python, Express.js, MongoDB, Tesseract OCR"
https://devfolio.co/projects/sensus,Sensus,Sensus-Journally Yours. Implementation of a sentiment analyserAPI coupled with the use of a natural language processing machine learning model equips our online journal to analyse user's mental state.,,,"React, Node.js, Nginx, Amazon Web Services (AWS), Express.js, MongoDB, Google Cloud Platform (GCP)"
https://devfolio.co/projects/manasthiti-1032,ManaSthiti,A safe space for mental health,,,"Firebase, Angular"
https://devfolio.co/projects/tickerteller-2d2a,TickerTeller,"Empowering Investment Decisions: Stock and Financial News Insights through Forecasting, Machine Learning & Sentiment Analysis",,,"TensorFlow, Machine Learning, Deep Learning, Python, Natural language processing (NLP), MongoDB Atlas, Long short-term memory (LSTM), Generative AI, Prompt Engineering, taipy"
https://devfolio.co/projects/airpower,AirWatt,All-in-one energy management solution.,,,"React, REST API, Flutter, Arduino, Firestore, Firebase Authentication, LSTM-Keras, GSAP"
https://devfolio.co/projects/green-dao-60b6,Green DAO,"Building the farmers for the next generation. It's a DAO to help the farmers with Supply Chain Management, getting an identity, and applying for loans.",,,"Next.js, Tailwind CSS, Polygon, Replit, Filecoin, Spheron, Router Protocol, Cadence, flow, 5ire"
https://devfolio.co/projects/ehr-b7fd,EHR,Making Health records More Secure & easily accessible than ever before.,,,"IPFS, Node.js, Next.js, Express.js, MongoDB Atlas"
https://devfolio.co/projects/donatlive-8316,Donat3.live,"Donat3.live is a web3 live streaming monetization platform. We offer widgets that allow creator to accept crypto tips from viewers' Coinbase Smart Wallets, with all tips displayed in real time.",,,"Solidity, Elixir, Nodejs, reactjs, Wagmi, RainbowKit, Quicknode, Phoenix Liveview, Pheonix"
https://devfolio.co/projects/punto-per-punto-soluzioni-pdf-37fb,Punto per punto soluzioni pdf,Punto per punto soluzioni pdf,,,Python
https://devfolio.co/projects/decertify-7000,deCertify,Decentralized Certificate Verification Platform - Security and Verification of Certificates using the power of BlockChain,,,"Solidity, Next.js, ethers.js, React Native, Blockchain, Tailwind CSS, Celo"
https://devfolio.co/projects/vidshield-81a6,🚀🔥💰VidShield 🥇😎🚀,🥇🤖 A Creator platform with Video NFT and Piracy protection 💰🔥,,,"CryptoJS, Biconomy, Livepeer, Truffle, Polygon, Filecoin, moralis, Semantic-ui-react, alchemy, Spheron"
https://devfolio.co/projects/vodafone-giga-tv-box-bedienungsanleitung-pdf-3009,Vodafone giga tv box bedienungsanleitung pdf,Vodafone giga tv box bedienungsanleitung pdf,,,Python
https://devfolio.co/projects/cours-de-photographie-pdf-4e77,38 cours de photographie - pdf,38 cours de photographie - pdf,,,Python
https://devfolio.co/projects/ppx-2d91,P2PX,"P2PX is a fully decentralized p2p exchange for crypto-to-fiat (USDT/INR) trades. We enable p2p trades between anonymous users with a decentralized reputation system called ""Proof-of-credibility""",,,"Solidity, React Native, ethersjs, Hardhat framework"
https://devfolio.co/projects/elayted-c8a3,Elayted,Go back in time in a snap!,,,"JavaScript, Flask, Natural Language Toolkit (NLTK), Elastic Search, Nodejs"
https://devfolio.co/projects/sarazaiten-a2c4,Sarazaiten : New Approach to GPT Era Education,"Educate the masses, Efficiently and Effectively",,,"React, Node.js, Express.js, OpenAi, axios, Netlify, Google Cloud API"
https://devfolio.co/projects/pragyanai-097f,PragyanAI,"personal, multilingual AI learning agent",,"Language Barriers: Prevent access to quality education.
One-Size-Fits-All Content: Doesn’t cater to individual learning styles.
Passive Learning: Fails to engage students effectively.
Limited Accessibility: Not adaptable to different learning preferences (visual, auditory, etc.).
Difficulty with Complex Concepts: Lack of proper visualization.
Lack of Personalization: No customized study materials based on progress.","HTML, React, JavaScript, Next.js, Python, Google Cloud Platform (GCP), Vercel, RestAPIs"
https://devfolio.co/projects/sarv-sahamati,Sarv Sahamati,Consent Manager for all!,,,"React, Node.js, JS, HTML5, Python, Adobe XD, Express.js, MongoDB, SCSS"
https://devfolio.co/projects/artfolio-83da,Artfolio,Ethereal Creations Unleashed,,,"CSS, npm, Figma, Web3, Vercel, reactjs, Blocto, Cadence, Flow CLI"
https://devfolio.co/projects/yoga-plus-fe53,Yoga Plus,Peace with mind and Body,,,"Firebase, TensorFlow, Flutter, CSS3​, HTML5​"
https://devfolio.co/projects/stree-women-security-and-empowerment-app-3313,STREE - Women Security and Empowerment App.,"STREE supports the development of an individual woman’s life by empowering them on aspects like Safety, Financial Empowerment, Skill Development, Government Scheme Awareness to lead a better tomorrow.",,,"Firebase, Java, XML, Android SDK, GitHub, Room Database, Angular Studio, Google Location services"
https://devfolio.co/projects/tech-combo-device,Tech combo device,SMART POLLUTION MONITORING SYSTEM USING IOT and Machine learning.,,,"Machine Learning, Internet of Things (IoT), Embedded Systems"
https://devfolio.co/projects/serenity-ai-ce0d,Serenity AI,We are listening.,,,"Machine Learning, Python, Flutter"
https://devfolio.co/projects/srot-6607,STUDENT MANAGEMENT APP,Let us make student life easy,,,"Django, JavaScript, AJAX, Flask, Python, Twilio, CSS3​, HTML5​"
https://devfolio.co/projects/game-of-luck-0f55,Game of Luck,Test your luck and see if you are lucky enough to win this game.,,,"CSS, JavaScript, HTML5, Bootstrap​"
https://devfolio.co/projects/verifund-5d68,Verifund,"Verified Giving, Amplified Impact",,,"Solidity, IPFS, React, Next.js, TypeScript, Tailwind CSS, AI/ML, NFT"
https://devfolio.co/projects/palm-f010,P.A.L.M,Post Accident Life-saving Module,,,"JavaScript, Android Studio, XML, Arduino Uno"
https://devfolio.co/projects/ingrid-d-rental-platform-53a1,Ingrid - 3D rental platform !,Experience the convenience of renting with our AR-powered system! Gain access to a huge collection of properties without making an ownership commitment.,,,"HTML, Firebase, CSS, JavaScript, ARCore, Unity, AR/VR, Firebase Authentication"
https://devfolio.co/projects/eduar-c3c2,Edu-AR,The complete platform to make Online Classes interactive and fun with the use of Augmented Reality (AR).,,,"Node.js, Heroku, Socket.IO, GitHub, Express.js, React Native, Material-UI, React.js, Google AR Core"
https://devfolio.co/projects/personal-safety-alertz-app,PERSONAL SAFETY ALERTZ APP 👧👨‍👩‍👧️🔋,Bringing you the PERSONAL SAFETY ALERTZ APP to assure your loved ones about your safety.,,,"SQLite, XML – layout designing, Google Places API"
https://devfolio.co/projects/hackdoc,HACKDOC,"Why to make wrong decisions, risking life and then to regret, when we are here to help you.Hackdoc, saving life, with no extra efforts, just get smart, get all info ,save time and live a healthy life.",,,"Bootstrap, Node.js, CSS, Embedded Javascript (EJS), Express.js, Passport.js, MongoDB Atlas, Google API, Auth0, Heruko"
https://devfolio.co/projects/rural-edtech-3d95,Rural EdTech,Our project aims to bridge the educational gap between rural and urban areas by providing accessible resources and support to students in rural communities.,,,"Node.js, JavaScript, PostgreSQL, Express.js, OpenAi, HTML/CSS, ChatterBot, React.js, Prisma, Auth"
https://devfolio.co/projects/ingles-idiomatico-pdf-gratis-3167,Ingles idiomatico 2 pdf gratis,Ingles idiomatico 2 pdf gratis,,,Python
