urlOfProject,nameOfProject,descriptionOfProject,problemSolved,challengesFaced,technologiesUsed
https://devfolio.co/projects/anyverify-your-friendly-wallet-verification-tool-daba,AnyVerify - Your Friendly Wallet Verification Tool,A decentralised & easy to use Discord-Metamask Verification Tool to enable projects to interact with project stakeholders more closely.,,,"React, Firebase, MetaMask, Python, ethers.js, Web3, Database, Blockchain"
https://devfolio.co/projects/smart-traffic-system,Smart Traffic System,Traffic Rule Violation Detection System and Speed Tracking,,,"TensorFlow, Tkinter, Python, OpenCV-Python, openALPR"
https://devfolio.co/projects/parke-3,Parke,"Whether you are moving across town or towards your dreams, having a safe reliable spot for your transport brings a huge peace of mind. Let us have your snags. Reserve your space, drive sans worries.",,,"React, Firebase, Dart, Redux, Figma, Adobe Illustrator, Express.js, MongoDB, Adobe After Effects, CI/CD"
https://devfolio.co/projects/beyondclub-0ac2,BeyondClub,No-code NFT Loyalty Program for real-world brands and customers,,,"Solidity, Next.js, The Graph, Tailwind CSS, Gnosis Chain, Polygon"
https://devfolio.co/projects/isp-finder,ISP Finder,Find Internet service providers in your area by entering your pincode.,,,"Firebase, AngularJS"
https://devfolio.co/projects/rakshak-dee4,Rakshak 2.0,"Empowering industry issues with Blockchain Data Security, Seamless Queue Management, AI-Driven Workspaces, and .Smart SOS.",,,"Solidity, IPFS, JavaScript, ML Kit, Python, MongoDB, Tailwind CSS, Smart Contracts, Express, React.js"
https://devfolio.co/projects/avex-4974,Avex,"A secure, privacy maintained and decentralized wechat",,,"Solidity, Flutter, PostgreSQL, Rust, DigitalOcean, Riverpod, IPFS / Filecoin, MPC, Meilli-Search"
https://devfolio.co/projects/stree-a-breast-cancer-diagnostic-platform-fd24,Stree - A Breast Cancer Diagnostic Platform,Our One Stop Breast Cancer Solution for your Protection.,,,"PHP, React, Firebase, JavaScript, NumPy, Python, XAMPP, Tensorflow & Keras, HTML/CSS, sklearn"
https://devfolio.co/projects/vidyanetai-11e8,Vidya-Net.AI,"Network, Learn & Earn with Vidya-Net.AI",,,"Firebase, Django, Java, Augmented Reality, Artificial Intelligence, WebRTC, Google Serp API"
https://devfolio.co/projects/seevid,SeeVid,Perceive what you desire,,,"React, Node.js, Flask, Natural language processing (NLP), Express.js, MongoDB, MERN stack, Image Processing, Deep Neural Networks"
https://devfolio.co/projects/ire-reborn-bca7,5ire Reborn,The redesigned landing page for 5ire network is a stunning visual experience that showcases cutting-edge design and engaging animations to onboard or at least keep users engaged in the world of web3.,,,"React, Next.js, Three.JS, TypeScript, Tailwind CSS, Framer"
https://devfolio.co/projects/certifi-9785,Certifi,Professional documents repository on Flow blockchain,,,"Node.js, TypeScript, React.js, Swagger UI, FCL, Cadence"
https://devfolio.co/projects/smart-home-1908,Smart Home,Automating the Home using IoT,,,"Arduino Uno, Arduino IDE, C++, Embedded C, NodeMCU IoT, Blynk"
https://devfolio.co/projects/athena-bea8,.,.,,,React
https://devfolio.co/projects/flux,Flux,Virtual Data Room with data processing and enrichment capability supported by simple Query layer,,,"Docker, Kubernetes, Spark, Neo4j, Apache Kafka, Spring Boot, Apache Beam, Spring Cloud, Grakn"
https://devfolio.co/projects/diskspace-4,DiskSpace 3.0,Welcome to the world of decentralized storage with faster and safer accessibility of your own data,,,"Flask, Android, REST API, Artificial Intelligence, Python, Encryption, Moibit"
https://devfolio.co/projects/aidenanalysis,Let's turn it into something positive,"Since, we know, we'll be grabbing a lot of eyeballs on this, I would request each & everyone of you to help to the people around you. Let's donate towards COVID 19 relief fund & fulfil our duty.",,,"React, Flask, TensorFlow, WebSockets, Google Colab, Python, Posenet, Twilio, UPI, Google Cloud Platform (GCP), twilio-video"
https://devfolio.co/projects/payzoll-9035,PayZoll,Decentralised payroll protocol,,,"Solidity, CSS, web3.js, React.js, Hardhat, Ethereum Blockchain, Chart.js., Okto React SDK"
https://devfolio.co/projects/ar-app-of-monuments-2903,-,-,,,PyTorch
https://devfolio.co/projects/krishi-iob-build-a-blockchain-2d27,krishi IoB {Build a Blockchain},"An open-source, blockchain powered solution for agricultural applications.",,,"React, Firebase, Firestore, Ionic Framework, Substrate node-template, substrate sidecar, substrate frontend node template, substrate api explorer"
https://devfolio.co/projects/medical-blocks,Medical Blocks,"Seamlessly share medical records, and get speedy healthcare.",,,"Node.js, Firebase, AngularJS, Hyperledger, TypeScript, Blockchain"
https://devfolio.co/projects/stream-rent-d208,Stream Rent,Renting NFTs by streaming cashflows.,,,"Solidity, OpenZeppelin, Biconomy, web3.js, Portis, Truffle Suite, Hardhat, Superfluid, Matic Testnet"
https://devfolio.co/projects/odin-6ddc,ODIN -  Guarding the Gateway to Web3 Valhalla,ODIN is bonded service on ethereum via EigenLayer that works with block builders to pause dapps before a malicious transaction is executed by simulating protocol invariants and economic incentives.,,,"Solidity, JavaScript, Golang, Bash, foundry, Anvil, kurtosis, cast"
https://devfolio.co/projects/brian-bb34,Brian,Brian simplifies complex concepts and builds transactions in plain English. Empowering users with accessible Web3 knowledge.,,,"AAVE, The Graph, Gnosis Chain, Hardhat, Optimism, HuggingFace, Viem, TAIKO, Gateway, LLMs"
https://devfolio.co/projects/befit-98df,BeFit.,"BeReal but with pushups. Get Active, Stay Accountable, and Get Rewarded with Friends! Let's make fitness fun again with BeFit!",,,"Solidity, JavaScript, OpenCV, Python, Rust, Node, Mediapipe"
https://devfolio.co/projects/bonfire-f0e6,Bonfire,Where friends and marshmallows get toasty,,,"Dagger, ARCore, ML Kit, Android Studio, Figma, Retrofit, Firestore, Firebase Authentication, Agora API"
https://devfolio.co/projects/sanskriti-87c5,Sanskriti,Sanskriti (e-commerce site) is built on ETH network allowing local businesses to sell and buy products instanty without going through long process of verification (thanks to our Fast KYC process).,,,"Solidity, Node.js, Vue.js, JavaScript, Tesseract OCR, Tailwind CSS, Binance, HTML/CSS, Face Recognition, Polygon"
https://devfolio.co/projects/zkonnect-119f,zKonnect,Zero Knowledge. Zero Hassle.,,,"Solidity, Next.js, TypeScript, The Graph, Hardhat, Circom, Snark.js, Polygon ZKEVM, Scaffold-Eth2, Coinbase Development Platform"
https://devfolio.co/projects/agroconnect-cc4f,AgroConnect,Revolutionising farm-to-table experience,,,"REST API, Redux, Ethereum, React.js (Frontend Framework), Javascript (React & Testing), Djano (User Authentication), Firebase (Database), Truffle (Development Framework), Ethers.js ("
https://devfolio.co/projects/tales-3793,Tales,"Publish without limits on Flow, Join the Decentralized Blogging Revolution",,,"IPFS, React, Redis, TypeScript, Nodejs, Cadence"
https://devfolio.co/projects/instaaid-463b,InstaAid,An IoT based solution to avail essential healthcare items and remove social awkwardness,,,"Mapbox, Internet of Things (IoT), PostgreSQL, NodeMCU IoT, Nodejs, reactjs, Prisma, Cachfree"
https://devfolio.co/projects/kanya-dc62,Kanya,"Provide, Prepare and Protect",,,"CSS, JavaScript, HTML5​"
https://devfolio.co/projects/watcher-51cf,Watcher,"Don't worry we are here for you , sleep tight we got you fully covered because we are awake like an owl.",,,"Firebase, Flask, Java, Mapbox, Deep Learning, Flutter, MongoDB, React js, FAST API, YOLOV5"
https://devfolio.co/projects/nexum-bee5,Nexum,Empowering relationships between creator and their communities,,,"React, Docker, SQL server, Tailwind CSS, Nodejs, .NET core, Cadence, Flow blockchain"
https://devfolio.co/projects/gamlafund-5970,Gamla.fund,"Community-saving funds, empower the community to perform peer-to-peer saving, borrowing, lending on their own terms, feasibility, and needs. Where trust and security are integrated with integrity.",,,"Solidity, React.js, Hardhat"
https://devfolio.co/projects/early-skin-disease-detection-e8f5,EARLY SKIN DISEASE DETECTION,"Predictions of skin diseases in their early stages are today's need. For achieving this, we would like to introduce our early skin disease detector model using deep learning.",,,"JavaScript, TensorFlow, Python, MongoDB, Pillow, Keras CNN, PIL, HTML/CSS, ISIC, HAM-1000"
https://devfolio.co/projects/organize,Organ-ize,To secure the organ donor’s medical records using data encryption until his/her demise and then delegate access to concerned authorities using NuCypher’s PRE network and Shamis’s Secret Sharing Scheme,,,"IPFS, NuCypher, Flask"
https://devfolio.co/projects/biblia-etiope-espanol-pdf-e182,Biblia etíope español pdf,Biblia etíope español pdf,,,Python
https://devfolio.co/projects/course-allocation-system-ed3f,Course Allocation System,Course Allocation System serves as a portal to automate the process of Allocation of Elective/Audit Courses and for Management of Courses in a convenient manner.,,,"jQuery, PHP, Bootstrap, JavaScript, AJAX, MySQL, Python3"
https://devfolio.co/projects/duber-decentralized-uber-app-5ac0,DUber (Decentralized Uber App),DUber is a decentralized ridesharing app intended to preserve user privacy. It runs on blockchain technology making it immutable and tamperproof. The goal is to shift to a decentralized environment.,,,"Solidity, CSS, Web3, Ganache, Nodejs, reactjs, JavascriptTestLibraries"
https://devfolio.co/projects/nft-multisender-e89d,NFT Multisender,An NFT multisender tool to transfer multiple NFTs in one click also against specific collection metrics with cross-chain capabilities.,,,"Solidity, Next.js, GraphQL, TypeScript, MongoDB, Web3, Tailwind CSS, Apollo Server"
https://devfolio.co/projects/atm-program-using-mysql-workbench-6391,ATM program using Mysql Workbench.,"Here we are registering ,logging in & performing transaction using MySQL.",,,"PyCharm, Mysql Workbench"
https://devfolio.co/projects/yourmedic-9f57,YourMedic,"Thank you for the apple, Doctor!",,,"React, Three.JS, OpenAi, Microsoft Azure, Auth0, Nodejs"
https://devfolio.co/projects/group-chat-using-flutter-and-firebase,Group Chat using Flutter and Firebase,Snapshots based Flutter mobile app for quick group chats,,,"Firebase, Visual Studio Code, Flutter, Firestore"
https://devfolio.co/projects/klubhub-2429,KlubHub,Klubhub is an interface that centralizes the functioning of clubs.,,,"Django, Python, Figma, CSS3​, HTML5​, Bootstrap​"
https://devfolio.co/projects/autosaved-13ac,autosaved,Never worry about losing your code,,,"Go, Git, CLI, Cobra, Viper, systemd, Daemon"
https://devfolio.co/projects/cupcakes-0027,Cupcakes,Cross Chain Ecosystem - A Piece of Cake. Now every developer can create zaps to execute multiple transactions for their users with a few clicks.,,,"Solidity, React, Nodejs, Spheron, EPNS, EIP-4337, EF: Account Abstraction, Relayers, Smart Contract Wallets"
https://devfolio.co/projects/quiz-down-62df,Quiz Down,Quiz Down is an educational app that aims to make learning more fun and provides a platform for the user to test their wits.,,,"Android Studio, Git, GitHub, Kotlin, XML/JSON, Open Trivia API"
https://devfolio.co/projects/basic-banking-app,Basic Banking App,A simple banking android app to showcase my skills on android studio.,,,"Java, Android Studio, SQLite"
https://devfolio.co/projects/note-capsule-98a8,Note Capsule,"Note Capusle : Just write and Forget, We would take care of Security",,,"Solidity, Ethereum, React js, Truffle Suite"
https://devfolio.co/projects/girlsarena-2000,GirlsArena,GirlsArena is a web based application to help all the amazing women and girls to find various opportunites in tech.,,,"Flask, Heroku, Selenium, Python, BeautifulSoup, reactjs"
https://devfolio.co/projects/smart-naka-cf33,Smart Naka,Tracking vehicles smartly,,,"JavaScript, OpenCV, SQL, Python, Flutter, Amazon Web Services (AWS), Twilio, DynamoDB, YOLOv3 Algorithm, Tesseract OCR"
https://devfolio.co/projects/narad,Narad,The difference between awareness and ignorance.,,,"React, Node.js, Next.js, Golang, React Native"
https://devfolio.co/projects/shop-here,Shop Here,A platform to explore offline products in online fashion.,,,"CSS, JavaScript, HTML5, Python"
https://devfolio.co/projects/iot-smart-poles,IOT smart poles,IoT enabled a smart poles system that can able to transmit data whenever pole wire gets cut down during heavy rain and other reasons.,,,"Internet of Things (IoT), Arduino, GPS, Sensors"
https://devfolio.co/projects/heart-disease-predictor,Heart Disease Predictor,"A web application which uses Machine Learning algorithms to predict the heart condition of a user by providing some inputs about the user's health like age, blood pressure, cholesterol level etc.",,,"HTML, Flask, scikit-learn, Machine Learning, Python, CSS3"
https://devfolio.co/projects/protecther-813b,protectHER,Providing women and evidence security,,,"Firebase, Android Studio, Android SDK, Google Maps API, Firestore, Netlify, reactjs, CSS3​, HTML5​"
https://devfolio.co/projects/atomik-6808,AtomiK,"The first DEX doing cross-chain atomic swaps with ZK for liquidity providing, increasing security in bridging between Aleo & XDC (EVM compatible chains).",,,"Solidity, React, JavaScript, Figma, Hardhat, WASM, Aleo, Web Assembly, Excalidraw"
https://devfolio.co/projects/closure-and-ck-calculator-1cbf,Closure and CK Calculator,"Created this web app using HTML,CSS and Java script. User can find Closure ,Candidate keys and normalized of Function dependencies",,,"JavaScript, CSS3, HTML5​"
https://devfolio.co/projects/medicfree-71e2,MedicFree,"An online healthcare management ecosystem which focuses on government-run healthcare facilities. It provides users information about stocks of medicines, doctor consultancy, etc.in their nearby hubs",,,"Bootstrap, React, Postman, Python, Express.js, JSX, MongoDB, pyTesseract, Tableau, Nodejs"
https://devfolio.co/projects/zerogravity-0ea9,ZeroGravity,The Weight is Over! ZeroGravity employs a weightless neural network architecture to reduce the proving of inference to lookup arguments on a highly optimised Bloom filter implementation.,,,"Moon math, Bloom filters, Aleo, Lookup arguments, Weightless Neural Networks"
https://devfolio.co/projects/turtleshell-efef,🐢 TurtleShell,"Turtleshell brings Smart Contract security data on-chain, providing transparency, composability, and programmable on-chai data.",,,"The Graph, Gnosis Chain, Optimism, Mantle, Scroll, TAIKO, BASE"
https://devfolio.co/projects/whistleblower,WhistleBlower,Anonymous Whistle Blowing aimed at the security of whistleblowers.,,,"CSS, JS, MetaMask, Matic, Web3, Ethereum"
https://devfolio.co/projects/ambulance-booking-system-emergitrack-06a1,Ambulance Booking System - EmergiTrack,"The Ambulance Booking System is an innovative solution designed to streamline the process of booking and tracking ambulances efficiently.The system consists of three portals: User,Hospital,and Driver.",,,"JavaScript, Express.js, MongoDB, MongoDB Atlas, axios, Tailwind CSS, Nodejs, ejs, RestAPIs, Vonage API"
https://devfolio.co/projects/full-stack-development-d1f0,Vaccine For Every Indian,"Reaching out to each and every Indian, increased vaccination in areas with poor healthcare facilities, and simultaneously minimizing overall vaccine wastage!",,,"Bootstrap, React, Node.js, Heroku, PostgreSQL, Express.js, MongoDB, Netlify, Material-UI, Google Sheets"
https://devfolio.co/projects/marsmello-a90e,MarsMello,Bring Out Your Inner Musk! #BUIDL Industries on a digital and truly decentralised Mars!,,,"Solidity, Ethereum, The Graph, Uniswap, NFT, Portis, Truffle Suite, Polygon, react spring, React UseGesture"
https://devfolio.co/projects/financial-wellbeing-9d5a,Financial Wellbeing for Everyone,"Reflect on your habits - learn from the spending patterns, create personalized value-add based on the payment categorization data for users and financial information providers eventually",,,"Node.js, JavaScript, TypeScript, ReactNative, Setu AA Sandbox, PhonePe Pulse"
https://devfolio.co/projects/alfabeto-per-tricotin-pdf-gratis-02d2,Alfabeto per tricotin pdf gratis,Alfabeto per tricotin pdf gratis,,,Python
https://devfolio.co/projects/medmate-a6ea,MedMate,"Take control of your medication with our easy-to-use app. MedMate helps you track and manage all of your prescribed and over-the-counter medications, including refill and expiration dates.",,,"Django, Dart, Python, Flutter, Natural language processing (NLP), PostgreSQL, Computer Vision"
https://devfolio.co/projects/backprop,Backprop,Build your own Credit Scores,,,"AngularJS, Python"
https://devfolio.co/projects/greenearn-411f,Green 2 Earn,"A blockchain ecosystem leveraging the potential of the Carbon Credit. It features a Green Shop, Green Launcher for crowdfunding, and a Green Map. Users earn G2E tokens for eco-actions.",,,"Next.js, Google Maps API, nestjs, Near Smartcontract"
https://devfolio.co/projects/juego-de-mesa-clue-para-imprimir-pdf-15c0,Juego de mesa clue para imprimir pdf,Juego de mesa clue para imprimir pdf,,,Python
https://devfolio.co/projects/freyja,Freyja,Web app to grade essay.,,,"React, Django, TensorFlow"
https://devfolio.co/projects/flush-cde7,Flush,Flush aims to provide quick and nearby access to sanitation and toilets in all parts of the world by creating a map of all toilets and incentivising users to add their own restrooms to the map.,,,"React, Node.js, Express.js, MongoDB Atlas, Material-UI"
https://devfolio.co/projects/women-safety-app-4,Women Safety App,This app is made with kotlin. It is useful for women safety. Womens can carry this app in their phone to feel themselves a safe one.,,,"Firebase, Android, Google Maps API, Kotlin, Room Database, LocationServices"
https://devfolio.co/projects/patio-station-7ec1,PAT.IO station,Ethereum Mainnet nodes as streaming infrastructure to guarantee and secure video and radio transmissions.,,,"Cryptography, Node.js, MetaMask, JavaScript, ethers.js, Ethereum, HTML/CSS, Vercel"
https://devfolio.co/projects/spyzier,SPYZIER,"Android based parental controller app which can fetch live location of child ,can access the sceen data (screenshots),message log and call logs with a single click from  the app.",,,"Firebase, Android, Java, XML, OAuth, Android SDK, Google Maps API, Android MediaProjection API, Networking"
https://devfolio.co/projects/themis,Themis ⚖,An oracle enabling Purchasing Power Parity on Ethereum to allow for more equitable and dynamic pricing of products allowing you to send and receive payments normalized to the geolocation of the users.,,,"Node.js, Matic, Ethereum, web3.js, Portis"
https://devfolio.co/projects/simplicate-87f2,Simplicate,Choose Simplicate to make your browsing fun.,,,"HTML, CSS, JavaScript"
https://devfolio.co/projects/the-story-interactive-timeline-for-nba-top-shot-4ae7,The Story - Interactive Timeline for NBA Top Shot,Introducing 'The Story' - a dynamic and engaging timeline view of expertly-curated NBA Top Shot moments that tell the stories woven into each NBA season.,,,"React, PostgreSQL, Golang, Tailwind CSS, Vercel, nextjs, Prisma"
https://devfolio.co/projects/the-book-ultimate-guide-to-rebuilding-civilization-pdf-0c1f,The book ultimate guide to rebuilding civilization pdf,The book ultimate guide to rebuilding civilization pdf,,,Python
https://devfolio.co/projects/hotel-management-system-4d65,Hotel Management System,Title of our project is Hotel Management System. Hotel Management System provides room booking and you can also check services provided by the hotel by just sitting at your home.,,,"PHP, Bootstrap, CSS, JS, XAMPP, GitHub, phpMyAdmin, Technologies used Html5"
https://devfolio.co/projects/shewin-we-care-she-wins-987d,Shewin - We Care She Wins,We here provide healthcare solutions and educa to women,,,"React, SASS, Docker, ML Classifier, Google Direction API, Firebase Authentication, FastAPI"
https://devfolio.co/projects/food-donation-management-system-4331,Food Donation Management System,It helps solve the problem of hunger and food wastage effectively.,,,"HTML, CSS, JavaScript, Flask, SQL, Python"
https://devfolio.co/projects/depocalyse-nft-market-2f57,Depocalypse NFT Marketplace 🛒,"A decentralized NFT market. Create your own NFTs in no time and put them up in the marketplace. Buying, Selling, Auctioning, or even putting NFTs for charity with so much ease has never been easier.",,,"IPFS, React, JavaScript, Ethereum, Chainlink, Portis, Superfluid, Truffle, Polygon, Filecoin"
https://devfolio.co/projects/xxx-ad89,.,.,,,HTML5​
https://devfolio.co/projects/aatmaniti-2828,AatmaNiti,Making Women Swawlambi,,,"HTML, Bootstrap, Node.js, CSS, JavaScript, Embedded Javascript (EJS), Socket Programming, Express.js, MongoDB Atlas, Tailwind CSS"
https://devfolio.co/projects/file-gaurdian-65df,File Guardian,Guardians of Your Confidentiality: Protecting Your Important Documents from unapproved access using web3 technology,,,"IPFS, React, TensorFlow, ethers.js, Ethereum, Blockchain"
https://devfolio.co/projects/dapplets-72b4,Dapplets x BOS integration,Dapplets provides tools for embedding Web3 applications into any web page. Now we are integrating BOS to deliver BOS-applications to millions of new users on existing sites.,,,"React, Rust, TypeScript, BOS, near-social-vm, near-vscode, Dapplets"
https://devfolio.co/projects/edmission-aad6,EdMission,Admissions Re-imagined.,,,"Flutter, Firebase Authentication, Agora API, Firebase Cloud Messaging, Firebase Firestore, dart language, Razorpay, Firebase Storage"
https://devfolio.co/projects/nft-docket-6f1b,NFT Docket,On-Chain warranties for your Products,,,"Chainlink, Polygon, IPFS / Filecoin"
https://devfolio.co/projects/hashcash,HashCash 2.0,HashCash is a Crypto-economic protocol to have better public communication tools.,,,"Solidity, React, Node.js, MongoDB"
https://devfolio.co/projects/class-bunk-manager-1,CLASS BUNK MANAGER,This a WebApplication that can be used by college-going students as here they can manage their attendance.,,,"jQuery, Bootstrap, Node.js, npm, HTML5, CSS3, Express.js, MongoDB"
https://devfolio.co/projects/saheli-every-step-of-the-way-d182,Saheli,Every step of the way,,,Android Studio
https://devfolio.co/projects/musicfy-4c26,Musicfy,AI base Music Application,,,Flutter
https://devfolio.co/projects/descargar-todas-las-cartas-de-yugioh-en-espanol-pdf-18e0,Descargar todas las cartas de yugioh en español pdf,Descargar todas las cartas de yugioh en español pdf,,,Python
https://devfolio.co/projects/distributed-health-record-management-cb66,Future Health,Removing siloization of Electronic Health Records by providing anytime-anywhere selective access of health records to doctors after authentication in a privacy-preserving manner across hospitals.,,,"Django, Rust, Nodejs, VueJS, pyUmbral"
https://devfolio.co/projects/metabulls-3a71,MetaBulls,MetaBulls = MetaVerse + Bulls (We all like bulls) Imagine a truly decentralize metaverse where you can hangout with your friends and play games without buying land parcels or paying anything.,,,"Solidity, IPFS, Node.js, WebRTC, Blender, Express.js, The Graph, Polygon, NFT.Storage, BablyonJs"
https://devfolio.co/projects/emotion-detection-and-music-recommendation-5c06,Emotion Detection and Music Recommendation,"Whatever your emotion, the programme can detect it and run the optimum music fitting for the mood of the person.",,,"TensorFlow, NumPy, OpenCV, Pygame, Python, Convolutional neural network (CNN)"
https://devfolio.co/projects/polkamusic-cec7,PolkaMusic,Listen to music. Earn NFT rewards. Burn NFTs for awesome gifts.,,,"React, MySQL, Linux, Rust, Substrate"
https://devfolio.co/projects/tokenizedtweets,TokenizedTweets,A bot that turns tweets into NFT tokens,,,"Solidity, Node.js, JavaScript, Matic, Express.js, Ethereum, web3.js"
https://devfolio.co/projects/multiple-disease-prediction-system,Multiple Disease Prediction System,This webapp was developed using Flask Web Framework and was deployed on Heroku server. The models used to predict the diseases were trained on large Datasets. The webapp can predict numerous diseases.,,,"HTML, Flask, TensorFlow, Keras, NumPy, pandas, Matplotlib, Python, Pillow, Sklrean"
https://devfolio.co/projects/finding-the-missing-child-7a0c,Finding the Missing Child....,A (Web+Mobile) Application tracking system which allows citizens to confirm if an unattended child is missing or not using Facial Recognition by Comparison from our Database of Missing Children.,,,"Firebase, Flask, OpenCV, Flutter, Google Maps API, Firebase Authentication, Deepface"
https://devfolio.co/projects/artwalk-f198,ArtWalk,"Walk crafted NFTs. 
Transform your Walk into NFT Masterpieces.",,,"Next.js, Mapbox, Cadence, Flow CLI, OnFlow/Fcl, Haversine, similarity API, Planetscale database, DeepAI, Dall-E image generation API"
https://devfolio.co/projects/feminine-5cf3,Feminine,Leveraging the power of AI for improving women health,,,"jQuery, PHP, TensorFlow, XAMPP, Microsoft Azure, HTML/CSS, Python3, django-rest-framework"
https://devfolio.co/projects/shiwu-1769,Shiwu,A soil detector and crop predictor to promote sustainable agriculture.,,,"Flask, TensorFlow, Machine Learning, Deep Learning, Keras CNN, cnn"
https://devfolio.co/projects/shewalkssafe-a-women-safety-application-fa1a,SheWalksSafe - A Women Safety Application,"A women safety app that helps women in emergency or dangerous situations or whenever they feel unsafe. Some of the features like Maps, SOS, Voice command, Camera or video, Tips are provided for safety",,,"Flutter, Google Maps API, Crimeometer API"
